{
  "schemaVersion": 1,
  "sourceArchive": {
    "url": "https://github.com/notofonts/noto-cjk/releases/download/Sans2.004/07_NotoSansCJKkr.zip",
    "sha256": "e26fcf98e75176d24984875377ab921dbb46055b88ed4a39454d91d6146c5654"
  },
  "license": {
    "spdx": "OFL-1.1",
    "file": "fonts/LICENSE-OFL-1.1.txt",
    "sha256": "6a73f9541c2de74158c0e7cf6b0a58ef774f5a780bf191f2d7ec9cc53efe2bf2"
  },
  "fonts": [
    {
      "weight": "Regular",
      "file": "fonts/NotoSansCJKkr-Regular.otf",
      "sha256": "0000000000000000000000000000000000000000000000000000000000000000"
    },
    {
      "weight": "Bold",
      "file": "fonts/NotoSansCJKkr-Bold.otf",
      "sha256": "26d0c6748500a0444844280b308f5b62c7ae92ac6c6ac88148e502dd211eb52a"
    }
  ]
}
